[
  {
    "id": "sy-fixture-transport-location",
    "name": {
      "en": "Fixture Transport Location"
    },
    "aliases": [],
    "locationTypes": ["trade_location"],
    "transportModes": ["road"],
    "operationalStatus": "unknown",
    "coordinates": {
      "latitude": 33.5,
      "longitude": 36.3
    },
    "administrativeLocation": {
      "governorateId": "sy-damascus",
      "localityName": {
        "en": "Damascus"
      }
    },
    "externalIds": {},
    "sourceIds": ["fixture-source"],
    "sourceReferences": [
      {
        "sourceId": "fixture-source",
        "sourceRecordId": "fixture-location",
        "sourceRecordDate": "2026",
        "accessedAt": "2026-07-08T00:00:00.000Z"
      }
    ],
    "sourceStatus": "released"
  }
]
