{
  "id": "sy-example-transport-location",
  "name": {
    "en": "Example Transport Location"
  },
  "aliases": [
    {
      "value": "Example Terminal",
      "language": "en",
      "type": "alias"
    }
  ],
  "locationTypes": ["terminal"],
  "transportModes": ["multimodal"],
  "operationalStatus": "unknown",
  "coordinates": {
    "latitude": 35,
    "longitude": 37
  },
  "administrativeLocation": {
    "governorateId": "sy-example-governorate",
    "localityName": {
      "en": "Example Locality"
    }
  },
  "externalIds": {
    "unLocode": "SYXXX"
  },
  "sourceIds": ["example-source"],
  "sourceReferences": [
    {
      "sourceId": "example-source",
      "sourceRecordId": "EXAMPLE-001",
      "sourceRecordDate": "2026",
      "accessedAt": "2026-07-08T00:00:00.000Z"
    }
  ],
  "sourceStatus": "released",
  "notes": "Example only."
}
